{"$schema":"https://json-schema.org/draft/2020-12/schema","type":"object","additionalProperties":false,"required":["interview_id","packet_ids","records","primary_packet_id","reserve_packet_id","verdict","next_permitted_action"],"properties":{"interview_id":{"const":"system-one-first-interview-1"},"packet_ids":{"type":"array","minItems":3,"maxItems":3,"uniqueItems":true,"items":{"pattern":"^system-one-seed-candidate-packet-","type":"string"}},"records":{"type":"array","minItems":3,"maxItems":3,"items":{"type":"object","additionalProperties":false,"required":["packet_id","verdict","fatal_or_unresolved_risk","evidence"],"properties":{"packet_id":{"pattern":"^system-one-seed-candidate-packet-","type":"string"},"verdict":{"enum":["admitted","killed"]},"fatal_or_unresolved_risk":{"type":"string","minLength":50},"evidence":{"type":"string","minLength":50}}}},"primary_packet_id":{"const":"system-one-seed-candidate-packet-3"},"reserve_packet_id":{"const":"system-one-seed-candidate-packet-2"},"verdict":{"const":"two-survivors-ready-for-execution-readiness"},"next_permitted_action":{"type":"string","minLength":60}}}
