{"interview_id":"system-one-first-interview-1","packet_ids":["system-one-seed-candidate-packet-1","system-one-seed-candidate-packet-2","system-one-seed-candidate-packet-3"],"records":[{"packet_id":"system-one-seed-candidate-packet-1","verdict":"killed","fatal_or_unresolved_risk":"The published contrast covers a broad, multivariate set of biofilm functional and structural outcomes. The packet does not predeclare one outcome family, transformation, multiplicity rule, or a direct contrast estimand, so a later choice can manufacture a contrast and the proposed test is not decisive.","evidence":"DataAnalysis.Rmd iterates separately across parameters, depth, and date; the packet itself calls for a fixed documented outcome set but does not define it. The available source record cannot supply that missing precommitment retrospectively."},{"packet_id":"system-one-seed-candidate-packet-2","verdict":"admitted","fatal_or_unresolved_risk":"The main risk is that only a small number of laboratory blocks are available and block composition may be inseparable from strain or handling. A held-block result will therefore test limited transfer, not a general spillover predictor.","evidence":"The primary paper, block table, and correlative R script establish replicated experimental blocks, fixed reported predictors, and pooled fitting with random block effects but no located held-block assessment."},{"packet_id":"system-one-seed-candidate-packet-3","verdict":"admitted","fatal_or_unresolved_risk":"The three recorded sites and a 305-day period may not capture device drift or all weather regimes. The test must not generalize beyond post-split periods at those sites.","evidence":"The paper records abrupt-condition failures; the official timestamped data and cv.r show random row folds within a site, enabling a fixed chronological holdout with no new measurement or specialist assumption."}],"primary_packet_id":"system-one-seed-candidate-packet-3","reserve_packet_id":"system-one-seed-candidate-packet-2","verdict":"two-survivors-ready-for-execution-readiness","next_permitted_action":"Run execution-readiness certification on the sensor primary and virus reserve independently. Do not execute, select finally, or send either to System 2 unless both satisfy data acquisition, reproducibility, preregistration, and bounded-interpretation checks."}
